{
  "lockVersion": 1,
  "plugin": "knowledgebase",
  "version": "0.1.2",
  "sourceSha256": "cd98bff143f575c80be04fb1aa69a45bcc9421e24fbf380693e4bca7de586aaa",
  "indexSha256": "951fbf9f197b33c378550734dd0a238030052fd29ab9767a4319ede55a1edfd8",
  "fetchedAt": "2026-10-27T17:12:06.617Z",
  "hosts": {
    "codex": {
      "url": "https://knowledge.chaselubitz.com/plugins/knowledgebase-chatgpt.zip",
      "zipSha256": "e70c26460383442c47cc79922fb0397106793bd88209e9801f50e22bafb33be3",
      "treeSha256": "de62dd824072ec5f0f53671038d676da196fe38836386e72ea012caef65fedf1",
      "fileCount": 8
    },
    "claude-code": {
      "url": "https://knowledge.chaselubitz.com/plugins/knowledgebase-claude-code.zip",
      "zipSha256": "5baa369ce0fe20c6c0eb099f90689e25ea8dc838dc29f6e2dbf180a32748f810",
      "treeSha256": "a44a23c205bb67b31aba7008a1cb84ac8dc9350b8615c9e6d647dfe7672b1ecb",
      "fileCount": 6
    }
  }
}
